{
 "pack_version": "1",
 "retailer": "biggreenegg.com",
 "eval_id": "SE-20261012T184220Z",
 "generated_at": "2026-10-12T18:44:38.924Z",
 "catalog_ref": "catalog.json",
 "generator": [
  "category-recall"
 ],
 "terms": [
  {
   "term": "kamado grill",
   "dataset": "head",
   "has_key": false,
   "relation": null,
   "source": "authored"
  },
  {
   "term": "charcoal",
   "dataset": "head",
   "has_key": true,
   "relation": null,
   "source": "catalog_node",
   "node_id": "charcoal",
   "query_template": "{node.singular}",
   "key": {
    "size": 4,
    "null_rate": 0,
    "confidence": "medium",
    "skus": [
     "natural-lump-hardwood-charcoal",
     "natural-lump-charcoal-canadian-maple",
     "100-natural-lump-charcoal-oak-hickory",
     "weather-proof-charcoal-storage-bag"
    ],
    "source_url": "https://biggreenegg.com/collections/charcoal"
   }
  },
  {
   "term": "grill cover",
   "dataset": "head",
   "has_key": true,
   "relation": null,
   "source": "catalog_node",
   "node_id": "covers",
   "query_template": "{node.singular}",
   "key": {
    "size": 12,
    "null_rate": 0,
    "confidence": "medium",
    "skus": [
     "cover-k-l-and-xl-for-53-modern-table",
     "cover-l-l-and-xl-for-72-modern-table",
     "cover-j-fits-76-cooking-island-for-xl-and-l",
     "cover-i-fits-nest-and-handler-or-nest-for-2xl",
     "cover-h-for-nest-handler-and-portable-nest-for-m-s-mx",
     "cover-g-fits-mx-and-mn-with-or-without-a-carrier",
     "cover-f-fits-built-ins-modular-nests-or-cooking-islands-for-xl-and-l-egg-domes",
     "cover-e-fits-acacia-table-for-l",
     "cover-d-fits-49-cooking-island-for-xl-and-l",
     "cover-c-fits-modular-nest-expansion-frame-for-xl-l-and-m-acacia-table-for-xl",
     "cover-b-fits-nest-and-handler-for-xl-l-modular-nest-for-m",
     "cover-a-fits-modular-nest-for-2xl-xl-and-l"
    ],
    "source_url": "https://biggreenegg.com/collections/covers"
   }
  },
  {
   "term": "thermometer",
   "dataset": "head",
   "has_key": true,
   "relation": null,
   "source": "catalog_node",
   "node_id": "thermometers",
   "query_template": "{node.singular}",
   "key": {
    "size": 9,
    "null_rate": 0,
    "confidence": "medium",
    "skus": [
     "wifi-display-predictive-thermometer-bundle",
     "wireless-predictive-thermometer",
     "wifi-display",
     "pro-chef-thermometer",
     "external-temperature-gauge-large-dial-3-8cm-750-f-400-c-fits-all-except-mini",
     "external-temperature-gauge-2-5cm-750-f-400-c",
     "bluetooth-dome-thermometer",
     "instant-read-digital-thermometer-with-bottle-opener",
     "instant-read-digital-food-thermometer"
    ],
    "source_url": "https://biggreenegg.com/collections/thermometers"
   }
  },
  {
   "term": "pizza stone",
   "dataset": "head",
   "has_key": false,
   "relation": null,
   "source": "authored"
  },
  {
   "term": "cutting board",
   "dataset": "head",
   "has_key": true,
   "relation": null,
   "source": "catalog_node",
   "node_id": "cutting-boards",
   "query_template": "{node.singular}",
   "key": {
    "size": 2,
    "null_rate": 0,
    "confidence": "medium",
    "skus": [
     "disposable-cutting-board",
     "bamboo-cutting-board"
    ],
    "source_url": "https://biggreenegg.com/collections/cutting-boards"
   }
  },
  {
   "term": "cookbook",
   "dataset": "head",
   "has_key": true,
   "relation": null,
   "source": "catalog_node",
   "node_id": "cookbooks",
   "query_template": "{node.singular}",
   "key": {
    "size": 2,
    "null_rate": 0,
    "confidence": "medium",
    "skus": [
     "david-roses-eggin-big-green-egg-cookbook-hardcover",
     "ray-lampes-dr-bbq-big-green-egg-cookbook-hardcover"
    ],
    "source_url": "https://biggreenegg.com/collections/cookbooks"
   }
  },
  {
   "term": "spatula",
   "dataset": "head",
   "has_key": true,
   "relation": null,
   "source": "catalog_node",
   "node_id": "spatulas",
   "query_template": "{node.singular}",
   "key": {
    "size": 1,
    "null_rate": 0,
    "confidence": "medium",
    "skus": [
     "grill-spatula-with-green-handle"
    ],
    "source_url": "https://biggreenegg.com/collections/spatulas"
   }
  },
  {
   "term": "tongs",
   "dataset": "head",
   "has_key": true,
   "relation": null,
   "source": "catalog_node",
   "node_id": "tongs",
   "query_template": "{node.singular}",
   "key": {
    "size": 1,
    "null_rate": 0,
    "confidence": "medium",
    "skus": [
     "silicone-tip-tongs-16-40-cm"
    ],
    "source_url": "https://biggreenegg.com/collections/tongs"
   }
  },
  {
   "term": "knife",
   "dataset": "head",
   "has_key": true,
   "relation": null,
   "source": "catalog_node",
   "node_id": "knives",
   "query_template": "{node.singular}",
   "key": {
    "size": 1,
    "null_rate": 0,
    "confidence": "medium",
    "skus": [
     "brisket-knife-12-stainless-steel"
    ],
    "source_url": "https://biggreenegg.com/collections/knives"
   }
  },
  {
   "term": "rub",
   "dataset": "head",
   "has_key": true,
   "relation": null,
   "source": "catalog_node",
   "node_id": "seasonings-rubs",
   "query_template": "{node.singular}",
   "key": {
    "size": 4,
    "null_rate": 0,
    "confidence": "medium",
    "skus": [
     "big-green-egg-seasoning-classic-steakhouse",
     "big-green-egg-seasoning-savory-pecan",
     "big-green-egg-seasoning-sweet-smoky",
     "big-green-egg-seasoning-ancho-chili-coffee"
    ],
    "source_url": "https://biggreenegg.com/collections/seasonings-rubs"
   }
  },
  {
   "term": "barbecue sauce",
   "dataset": "head",
   "has_key": true,
   "relation": null,
   "source": "catalog_node",
   "node_id": "barbecue-wing-sauce",
   "query_template": "{node.singular}",
   "key": {
    "size": 4,
    "null_rate": 0,
    "confidence": "medium",
    "skus": [
     "big-green-egg-wing-sauce-original-buffalo",
     "big-green-egg-wing-sauce-eds-famous",
     "big-green-egg-bbq-sauce-kentucky-bourbon-grilling-glaze",
     "big-green-egg-bbq-sauce-kansas-city-style-sweet-smoky"
    ],
    "source_url": "https://biggreenegg.com/collections/barbecue-wing-sauce"
   }
  },
  {
   "term": "hat",
   "dataset": "head",
   "has_key": true,
   "relation": null,
   "source": "catalog_node",
   "node_id": "hats",
   "query_template": "{node.singular}",
   "key": {
    "size": 12,
    "null_rate": 0,
    "confidence": "medium",
    "skus": [
     "the-paracord",
     "the-rustic-canvas",
     "the-weekender",
     "the-backyard-badge",
     "the-pitmaster",
     "the-cold-egg-green",
     "the-cold-egg-white",
     "embroidered-white-bge-74-hat",
     "green-with-tan-leather-patch-baseball-hat",
     "big-green-egg-silhouette-green-gray-hat",
     "50th-anniversary-trucker-hat-1",
     "big-green-egg-green-patch-baseball-hat"
    ],
    "source_url": "https://biggreenegg.com/collections/hats"
   }
  },
  {
   "term": "cooler",
   "dataset": "head",
   "has_key": true,
   "relation": null,
   "source": "catalog_node",
   "node_id": "bags-coolers",
   "query_template": "{node.singular}",
   "key": {
    "size": 4,
    "null_rate": 0,
    "confidence": "medium",
    "skus": [
     "big-green-egg-x-yeti-hopper-m30-tote-soft-cooler",
     "big-green-egg-x-yeti-hopper-flip-12-cooler",
     "big-green-egg-x-yeti-m20-backpack-cooler",
     "reusable-tote"
    ],
    "source_url": "https://biggreenegg.com/collections/bags-coolers"
   }
  },
  {
   "term": "igniter",
   "dataset": "head",
   "has_key": true,
   "relation": null,
   "source": "catalog_node",
   "node_id": "igniters",
   "query_template": "{node.singular}",
   "key": {
    "size": 15,
    "null_rate": 0,
    "confidence": "medium",
    "skus": [
     "quick-light-kit",
     "hell-hands",
     "split-heat-deflector",
     "twisters-fire-starters",
     "speedilight-sticks",
     "natural-lump-hardwood-charcoal",
     "natural-lump-charcoal-canadian-maple",
     "100-natural-lump-charcoal-oak-hickory",
     "ash-tool-for-s-mx-or-mn-eggs",
     "ash-tool-w-soft-grip-handle-for-l-or-m-eggs",
     "ash-tool-w-soft-grip-handle-for-2xl-or-xl-eggs",
     "ash-removal-pan",
     "grid-gripper-for-lifting-stainless-cooking-grids-and-planks",
     "weather-proof-charcoal-storage-bag",
     "eggniter-electric-charcoal-lighter-with-fan-1500-watt-120v"
    ],
    "source_url": "https://biggreenegg.com/collections/igniters"
   }
  },
  {
   "term": "fire starter",
   "dataset": "head",
   "has_key": true,
   "relation": null,
   "source": "catalog_node",
   "node_id": "fire-starters",
   "query_template": "{node.singular}",
   "key": {
    "size": 7,
    "null_rate": 0,
    "confidence": "medium",
    "skus": [
     "quick-light-kit-medium",
     "quick-light-kit-large",
     "quick-light-kit-xl-and-2xl",
     "quick-light-kit",
     "twisters-fire-starters",
     "speedilight-sticks",
     "speedilight-natural-charcoal-starters"
    ],
    "source_url": "https://biggreenegg.com/collections/fire-starters"
   }
  },
  {
   "term": "wood chips",
   "dataset": "head",
   "has_key": false,
   "relation": null,
   "source": "authored"
  },
  {
   "term": "table",
   "dataset": "head",
   "has_key": true,
   "relation": null,
   "source": "catalog_node",
   "node_id": "tables-stands",
   "query_template": "{node.singular}",
   "key": {
    "size": 60,
    "null_rate": 0,
    "confidence": "medium",
    "skus": [
     "modern-farmhouse-table-50-inch-for-large-egg-2025",
     "modern-farmhouse-table-69-inch-for-xl-egg-2025",
     "modern-farmhouse-table-69-inch-for-large-egg-2025",
     "modern-farmhouse-table-50-inch-for-xl-egg-2025",
     "hardware-pack-for-nest-xl-l-m-s",
     "4-in-locking-caster-kit-set-of-2-4-total",
     "hardware-pack-for-wood-egg-mates-all-sizes",
     "hardware-pack-for-composite-egg-mates-all-sizes",
     "solid-acacia-egg-mates-13-5-for-minimax",
     "solid-acacia-egg-mates-17-5-x-11-for-small",
     "solid-acacia-egg-mates-17-5-x-11-for-medium",
     "solid-acacia-egg-mates-17-5-x-11-for-large",
     "solid-acacia-egg-mates-17-5-x-11-for-xl",